### ISSUE TITLE
Unexpected ACK waiting before send response payload

### ISSUE THREAD

**Issue by bozaro** [hyperium/hyper#1209]
I have unexpected Iron server behaviour: if header size with payload is greater then 8Kb then Iron send header and waiting TCP ACK before sending response payload.

I write simple server like:
```rust
extern crate iron;

use iron::prelude::*;
use iron::middleware::Handler;

struct ResponseHandler(Vec<u8>);

impl Handler for ResponseHandler {
    fn handle(&self, _: &mut Request) -> IronResult<Response> {
        Ok(Response::with((iron::status::Ok, &self.0[..])))
    }
}

fn main() {
    // Generate fixed response with
    let mut data = Vec::<u8>::new();
    while data.len() < 1024 * 8 {
        data.push(b'0');
    }
    // Start server
    let addr = "localhost:8080";
    println!("http://{}/", addr);
    Iron::new(ResponseHandler(data)).http(addr).unwrap();
}
```

And listen traffic with tcpdump:
```
~$ sudo tcpdump -n -i lo port 8080 
tcpdump: verbose output suppressed, use -v or -vv for full protocol decode
listening on lo, link-type EN10MB (Ethernet), capture size 262144 bytes
19:21:40.623202 IP 127.0.0.1.47304 > 127.0.0.1.8080: Flags [S], seq 1689439725, win 43690, options [mss 65495,sackOK,TS val 717692042 ecr 0,nop,wscale 7], length 0
19:21:40.623224 IP 127.0.0.1.8080 > 127.0.0.1.47304: Flags [S.], seq 1198932556, ack 1689439726, win 43690, options [mss 65495,sackOK,TS val 717692042 ecr 717692042,nop,wscale 7], length 0
19:21:40.623242 IP 127.0.0.1.47304 > 127.0.0.1.8080: Flags [.], ack 1, win 342, options [nop,nop,TS val 717692042 ecr 717692042], length 0
-- Request received
19:21:40.623299 IP 127.0.0.1.47304 > 127.0.0.1.8080: Flags [P.], seq 1:79, ack 1, win 342, options [nop,nop,TS val 717692042 ecr 717692042], length 78: HTTP: GET / HTTP/1.1
19:21:40.623312 IP 127.0.0.1.8080 > 127.0.0.1.47304: Flags [.], ack 79, win 342, options [nop,nop,TS val 717692042 ecr 717692042], length 0
-- Header send (104 bytes)
19:21:40.623535 IP 127.0.0.1.8080 > 127.0.0.1.47304: Flags [P.], seq 1:105, ack 79, win 342, options [nop,nop,TS val 717692042 ecr 717692042], length 104: HTTP: HTTP/1.1 200 OK
-- ACK received
19:21:40.623551 IP 127.0.0.1.47304 > 127.0.0.1.8080: Flags [.], ack 105, win 342, options [nop,nop,TS val 717692042 ecr 717692042], length 0
-- Request payload send (8192 bytes)
19:21:40.623577 IP 127.0.0.1.8080 > 127.0.0.1.47304: Flags [P.], seq 105:8297, ack 79, win 342, options [nop,nop,TS val 717692042 ecr 717692042], length 8192: HTTP
19:21:40.623588 IP 127.0.0.1.47304 > 127.0.0.1.8080: Flags [.], ack 8297, win 1365, options [nop,nop,TS val 717692042 ecr 717692042], length 0
19:21:40.623751 IP 127.0.0.1.47304 > 127.0.0.1.8080: Flags [F.], seq 79, ack 8297, win 1365, options [nop,nop,TS val 717692042 ecr 717692042], length 0
19:21:40.623788 IP 127.0.0.1.8080 > 127.0.0.1.47304: Flags [F.], seq 8297, ack 80, win 342, options [nop,nop,TS val 717692042 ecr 717692042], length 0
19:21:40.623809 IP 127.0.0.1.47304 > 127.0.0.1.8080: Flags [.], ack 8298, win 1365, options [nop,nop,TS val 717692042 ecr 717692042], length 0
```

If I send less then 8Kb payload then Iron send header and payload in single TCP packet.

I would prefer to be able to send the response payload without waiting for the header to be received.

I do not understand the reason for this behavior and where to look for it. I will be grateful if you say where to find the reason for this behavior.

**Comment by seanmonstar** [comment]
I'm not super familiar with Iron, but I can talk about the TCP part, and how to adjust it with hyper. This is likely because Nagle's algorithm is enabled by default. You can try disabling it to get the second packet to be sent faster. Nagle's algorithm tries to group more bytes in packets, so it's a balance of bandwidth vs latency. To do so with hyper, you'd need to provide a custom `NetworkListener` instead of using `HttpListener` (or `Server::http`).

**Comment by bozaro** [comment]
Thanks a lot.

I can solve a problem by code like:
```rust
extern crate iron;
extern crate hyper;

use iron::prelude::*;
use iron::middleware::Handler;
use iron::Protocol;
use hyper::net::{NetworkListener, HttpStream};
use std::net::TcpListener;
use std::io;
use std::net::SocketAddr;
use std::sync::Arc;

struct ResponseHandler(Vec<u8>);

impl Handler for ResponseHandler {
    fn handle(&self, _: &mut Request) -> IronResult<Response> {
        Ok(Response::with((iron::status::Ok, &self.0[..])))
    }
}

#[derive(Clone)]
struct TcpListenerNoDelay {
    listener: Arc<TcpListener>
}

impl NetworkListener for TcpListenerNoDelay {
    type Stream = HttpStream;

    fn accept(&mut self) -> Result<Self::Stream, hyper::Error> {
        let tcp = try!(self.listener.accept());
        try!(tcp.0.set_nodelay(true));
        let stream = HttpStream(tcp.0);
        Ok(stream)
    }

    fn local_addr(&mut self) -> io::Result<SocketAddr> {
        self.listener.local_addr()
    }
}

fn main() {
    // Generate fixed response with
    let mut data = Vec::<u8>::new();
    while data.len() < 1024 * 8 {
        data.push(b'0');
    }
    // Start server
    let addr = "localhost:5000";
    println!("http://{}/", addr);

    let listener = TcpListener::bind(addr).unwrap();

    Iron::new(ResponseHandler(data))
        .listen(TcpListenerNoDelay { listener: Arc::new(listener) }, Protocol::http()).unwrap();
}
```
I think it's good idea to add `set_nodelay` method for `HttpListener`. I make PR for this change some later.

**Comment by bozaro** [comment]
I think I was happy early. We must dig deeper.

**Comment by bozaro** [comment]
So, as result, `TcpListenerNoDelay` really helps to me.

**Comment by seanmonstar** [comment]
As 0.10.x is no longer actively developed, I'm going to close this.
