### ISSUE TITLE
Data race while re-using IDLE connection, connection reset by peer

### ISSUE THREAD

**Issue by co42** [hyperium/hyper#3553]
**Version**
hyper: `0.14.28`

**Platform**
Linux / Mac

**Description**

I use hyper as a reverse proxy to some uvicorn servers which are configured with the default 5s keep-alive connection.

Sometimes an IDLE connection is re-used at the same time that it is closed by the uvicorn server, when it happen hyper starts to write the new request, then when it tries to read it failed with `Error connection error: Connection reset by peer (os error 54)` on Mac, `os error 104` on Linux.

To reproduce the bug I make a request every 5s to the server, sometimes I hit the data race.

<details>
<summary>TRACE logs : Working request (closed connection is removed)</summary>

```
14:42:13.721  INFO Request: GET / main.rs:154
14:42:13.721 DEBUG Creating proxied request reverse_proxy.rs:173
14:42:13.721 TRACE take? ("http", 10.42.30.212:5000): expiration = Some(15s) /Users/xcid/workspace/my-hyper/src/client/pool.rs:617
14:42:13.721 TRACE removing closed connection for ("http", 10.42.30.212:5000) /Users/xcid/workspace/my-hyper/src/client/pool.rs:295
14:42:13.721 TRACE checkout waiting for idle connection: ("http", 10.42.30.212:5000) /Users/xcid/workspace/my-hyper/src/client/pool.rs:643
14:42:13.721 TRACE Http::connect; scheme=Some("http"), host=Some("10.42.30.212"), port=Some(Port(5000)) /Users/xcid/workspace/my-hyper/src/client/connect/http.rs:278
14:42:13.721 DEBUG connecting to 10.42.30.212:5000 /Users/xcid/workspace/my-hyper/src/client/connect/http.rs:542
14:42:13.721 TRACE flushed({role=server}): State { reading: KeepAlive, writing: Init, keep_alive: Busy } /Users/xcid/workspace/my-hyper/src/proto/h1/conn.rs:731
14:42:13.751 DEBUG connected to 10.42.30.212:5000 /Users/xcid/workspace/my-hyper/src/client/connect/http.rs:545
14:42:13.751 TRACE client handshake Http1 /Users/xcid/workspace/my-hyper/src/client/conn.rs:1007
14:42:13.751 TRACE handshake complete, spawning background dispatcher task /Users/xcid/workspace/my-hyper/src/client/client.rs:515
14:42:13.751 TRACE flushed({role=server}): State { reading: KeepAlive, writing: Init, keep_alive: Busy } /Users/xcid/workspace/my-hyper/src/proto/h1/conn.rs:731
14:42:13.751 TRACE flushed({role=client}): State { reading: Init, writing: Init, keep_alive: Busy } /Users/xcid/workspace/my-hyper/src/proto/h1/conn.rs:731
14:42:13.751 TRACE checkout dropped for ("http", 10.42.30.212:5000) /Users/xcid/workspace/my-hyper/src/client/pool.rs:685
14:42:13.751 TRACE flushed({role=server}): State { reading: KeepAlive, writing: Init, keep_alive: Busy } /Users/xcid/workspace/my-hyper/src/proto/h1/conn.rs:731
14:42:13.751 TRACE Client::encode method=GET, body=None /Users/xcid/workspace/my-hyper/src/proto/h1/role.rs:1110
14:42:13.751 DEBUG flushed 240 bytes /Users/xcid/workspace/my-hyper/src/proto/h1/io.rs:318
14:42:13.751 TRACE flushed({role=client}): State { reading: Init, writing: KeepAlive, keep_alive: Busy } /Users/xcid/workspace/my-hyper/src/proto/h1/conn.rs:731
14:42:13.781 TRACE Conn::read_head /Users/xcid/workspace/my-hyper/src/proto/h1/conn.rs:193
14:42:13.781 TRACE received 135 bytes /Users/xcid/workspace/my-hyper/src/proto/h1/io.rs:267
14:42:13.781 TRACE Response.parse /Users/xcid/workspace/my-hyper/src/proto/h1/role.rs:946
14:42:13.781 TRACE Response.parse Complete(133) /Users/xcid/workspace/my-hyper/src/proto/h1/role.rs:955
14:42:13.781 DEBUG parsed 4 headers /Users/xcid/workspace/my-hyper/src/proto/h1/io.rs:208
14:42:13.781 DEBUG incoming body is content-length (2 bytes) /Users/xcid/workspace/my-hyper/src/proto/h1/conn.rs:224
14:42:13.781 TRACE decode; state=Length(2) /Users/xcid/workspace/my-hyper/src/proto/h1/decode.rs:127
14:42:13.781 DEBUG incoming body completed /Users/xcid/workspace/my-hyper/src/proto/h1/conn.rs:300
14:42:13.781 TRACE maybe_notify; read_from_io blocked /Users/xcid/workspace/my-hyper/src/proto/h1/conn.rs:471
14:42:13.781 TRACE flushed({role=client}): State { reading: Init, writing: Init, keep_alive: Idle } /Users/xcid/workspace/my-hyper/src/proto/h1/conn.rs:731
14:42:13.781 TRACE flushed({role=client}): State { reading: Init, writing: Init, keep_alive: Idle } /Users/xcid/workspace/my-hyper/src/proto/h1/conn.rs:731
14:42:13.781 TRACE put; add idle connection for ("http", 10.42.30.212:5000) /Users/xcid/workspace/my-hyper/src/client/pool.rs:337
14:42:13.781 DEBUG pooling idle connection for ("http", 10.42.30.212:5000) /Users/xcid/workspace/my-hyper/src/client/pool.rs:384
14:42:13.781 DEBUG Creating proxied response workload/sdk/src/utils/reverse_proxy.rs:157
14:42:13.781  INFO Response: 200 endpoints/proxy/src/main.rs:154
14:42:13.781 TRACE Server::encode status=200, body=Some(Known(2)), req_method=Some(GET) /Users/xcid/workspace/my-hyper/src/proto/h1/role.rs:342
14:42:13.781 TRACE sized write, len = 2 /Users/xcid/workspace/my-hyper/src/proto/h1/encode.rs:159
14:42:13.781 TRACE buffer.queue /Users/xcid/workspace/my-hyper/src/proto/h1/io.rs:595
14:42:13.782 DEBUG flushed 347 bytes /Users/xcid/workspace/my-hyper/src/proto/h1/io.rs:318
14:42:13.782 TRACE flushed({role=server}): State { reading: Init, writing: Init, keep_alive: Idle } /Users/xcid/workspace/my-hyper/src/proto/h1/conn.rs:731
14:42:13.782 TRACE flushed({role=client}): State { reading: Init, writing: Init, keep_alive: Idle } /Users/xcid/workspace/my-hyper/src/proto/h1/conn.rs:731
14:42:13.782 TRACE Conn::read_head /Users/xcid/workspace/my-hyper/src/proto/h1/conn.rs:193
14:42:13.782 TRACE received 0 bytes /Users/xcid/workspace/my-hyper/src/proto/h1/io.rs:267
14:42:13.782 TRACE parse eof /Users/xcid/workspace/my-hyper/src/proto/h1/io.rs:248
14:42:13.782 TRACE State::close_read() /Users/xcid/workspace/my-hyper/src/proto/h1/conn.rs:955
14:42:13.782 DEBUG read eof /Users/xcid/workspace/my-hyper/src/proto/h1/conn.rs:283
14:42:13.782 TRACE State::close_write() /Users/xcid/workspace/my-hyper/src/proto/h1/conn.rs:961
14:42:13.782 TRACE State::close_read() /Users/xcid/workspace/my-hyper/src/proto/h1/conn.rs:955
14:42:13.782 TRACE State::close_write() /Users/xcid/workspace/my-hyper/src/proto/h1/conn.rs:961
14:42:13.782 TRACE flushed({role=server}): State { reading: Closed, writing: Closed, keep_alive: Disabled } /Users/xcid/workspace/my-hyper/src/proto/h1/conn.rs:731
14:42:13.782 TRACE shut down IO complete /Users/xcid/workspace/my-hyper/src/proto/h1/conn.rs:738
14:42:16.240 TRACE idle interval checking for expired /Users/xcid/workspace/my-hyper/src/client/pool.rs:796
14:42:18.859 TRACE Conn::read_head /Users/xcid/workspace/my-hyper/src/proto/h1/conn.rs:193
14:42:18.859 TRACE flushed({role=server}): State { reading: Init, writing: Init, keep_alive: Busy } /Users/xcid/workspace/my-hyper/src/proto/h1/conn.rs:731
14:42:18.859 TRACE Conn::read_head /Users/xcid/workspace/my-hyper/src/proto/h1/conn.rs:193
14:42:18.859 TRACE received 121 bytes /Users/xcid/workspace/my-hyper/src/proto/h1/io.rs:267
14:42:18.859 TRACE Request.parse /Users/xcid/workspace/my-hyper/src/proto/h1/role.rs:148
14:42:18.859 TRACE Request.parse Complete(121) /Users/xcid/workspace/my-hyper/src/proto/h1/role.rs:153
14:42:18.859 DEBUG parsed 3 headers /Users/xcid/workspace/my-hyper/src/proto/h1/io.rs:208
14:42:18.859 DEBUG incoming body is empty /Users/xcid/workspace/my-hyper/src/proto/h1/conn.rs:224
```

</details>

<details>
<summary>TRACE logs : Failing request (closed connection is re-used)</summary>

```
14:42:18.860  INFO Request: GET / main.rs:154
14:42:18.861 TRACE take? ("http", 10.42.30.212:5000): expiration = Some(15s) /Users/xcid/workspace/my-hyper/src/client/pool.rs:617
14:42:18.861 DEBUG reuse idle connection for ("http", 10.42.30.212:5000) /Users/xcid/workspace/my-hyper/src/client/pool.rs:258
14:42:18.861 TRACE flushed({role=server}): State { reading: KeepAlive, writing: Init, keep_alive: Busy } /Users/xcid/workspace/my-hyper/src/proto/h1/conn.rs:731
14:42:18.861 TRACE Client::encode method=GET, body=None /Users/xcid/workspace/my-hyper/src/proto/h1/role.rs:1110
14:42:18.861 DEBUG flushed 240 bytes /Users/xcid/workspace/my-hyper/src/proto/h1/io.rs:318
14:42:18.861 TRACE flushed({role=client}): State { reading: Init, writing: KeepAlive, keep_alive: Busy } /Users/xcid/workspace/my-hyper/src/proto/h1/conn.rs:731
14:42:18.890 TRACE Conn::read_head /Users/xcid/workspace/my-hyper/src/proto/h1/conn.rs:193
14:42:18.891 TRACE State::close_read() /Users/xcid/workspace/my-hyper/src/proto/h1/conn.rs:955
14:42:18.891 DEBUG parse error (connection error: Connection reset by peer (os error 54)) with 0 bytes /Users/xcid/workspace/my-hyper/src/proto/h1/conn.rs:273
14:42:18.891 DEBUG read_head error: connection error: Connection reset by peer (os error 54) /Users/xcid/workspace/my-hyper/src/proto/h1/dispatch.rs:274
14:42:18.891 TRACE State::close_read() /Users/xcid/workspace/my-hyper/src/proto/h1/conn.rs:955
14:42:18.891 TRACE State::close_write() /Users/xcid/workspace/my-hyper/src/proto/h1/conn.rs:961
14:42:18.891 TRACE flushed({role=client}): State { reading: Closed, writing: Closed, keep_alive: Disabled } /Users/xcid/workspace/my-hyper/src/proto/h1/conn.rs:731
14:42:18.891 DEBUG error shutting down IO: Socket is not connected (os error 57) /Users/xcid/workspace/my-hyper/src/proto/h1/conn.rs:742
14:42:18.891 DEBUG client connection error: error shutting down connection: Socket is not connected (os error 57) /Users/xcid/workspace/my-hyper/src/client/client.rs:517
14:42:18.891 ERROR Internal server error: Proxy error: Proxy Error Hyper Error connection error: Connection reset by peer (os error 54) /rustc/82e1608dfa6e0b5569232559e3d385fea5a93112/library/core/src/convert/mod.rs:757:9
14:42:18.891  INFO Response: 500 main.rs:154
```

</details>

<details>
<summary>TCP dump : Failing request (closed connection is re-used)</summary>

```

15:42:13.654447 IP 10.42.30.212.commplex-main > xcid.57349: Flags [F.], seq 136, ack 241, win 488, options [nop,nop,TS val 2583782256 ecr 3061641057], length 0
15:42:13.654491 IP xcid.57349 > 10.42.30.212.commplex-main: Flags [.], ack 137, win 2050, options [nop,nop,TS val 3061646058 ecr 2583782256], length 0
15:42:13.654798 IP xcid.57349 > 10.42.30.212.commplex-main: Flags [F.], seq 241, ack 137, win 2050, options [nop,nop,TS val 3061646058 ecr 2583782256], length 0
15:42:13.685639 IP 10.42.30.212.commplex-main > xcid.57349: Flags [.], ack 242, win 488, options [nop,nop,TS val 2583782287 ecr 3061646058], length 0
15:42:13.721730 IP xcid.57351 > 10.42.30.212.commplex-main: Flags [S], seq 2835211086, win 65535, options [mss 1240,nop,wscale 6,nop,nop,TS val 1059768158 ecr 0,sackOK,eol], length 0
15:42:13.751094 IP 10.42.30.212.commplex-main > xcid.57351: Flags [S.], seq 2072536558, ack 2835211087, win 62643, options [mss 1460,sackOK,TS val 2583782353 ecr 1059768158,nop,wscale 7], length 0
15:42:13.751142 IP xcid.57351 > 10.42.30.212.commplex-main: Flags [.], ack 1, win 2053, options [nop,nop,TS val 1059768188 ecr 2583782353], length 0
15:42:13.751528 IP xcid.57351 > 10.42.30.212.commplex-main: Flags [P.], seq 1:241, ack 1, win 2053, options [nop,nop,TS val 1059768188 ecr 2583782353], length 240
15:42:13.780872 IP 10.42.30.212.commplex-main > xcid.57351: Flags [.], ack 241, win 488, options [nop,nop,TS val 2583782383 ecr 1059768188], length 0
15:42:13.781286 IP 10.42.30.212.commplex-main > xcid.57351: Flags [P.], seq 1:134, ack 241, win 488, options [nop,nop,TS val 2583782384 ecr 1059768188], length 133
15:42:13.781287 IP 10.42.30.212.commplex-main > xcid.57351: Flags [P.], seq 134:136, ack 241, win 488, options [nop,nop,TS val 2583782384 ecr 1059768188], length 2
15:42:13.781324 IP xcid.57351 > 10.42.30.212.commplex-main: Flags [.], ack 136, win 2050, options [nop,nop,TS val 1059768217 ecr 2583782384], length 0
15:42:18.861644 IP xcid.57351 > 10.42.30.212.commplex-main: Flags [P.], seq 241:481, ack 136, win 2050, options [nop,nop,TS val 1059773298 ecr 2583782384], length 240
15:42:18.890857 IP 10.42.30.212.commplex-main > xcid.57351: Flags [R], seq 2072536694, win 0, length 0
```

</details>

Is it an issue with `hyper`, `uvicorn` or an expected data race ?

**Comment by seanmonstar** [comment]
Unfortunately, this is somewhat expected behavior because of the racy nature of networking. The message from the server that it is closing the connection doesn't get to the client instantly, and so the client might use that connection.

The best way to deal with this is make your client side pool idle duration a little shorter than what the server is set to. For instance, if the server keeps things alive for 90s, a client idle timeout could be 88s, or something. Depends on your typical latency, too.

**Comment by co42** [comment]
My old proxy was using `actix` `awc` and did not seems to have this issue.

I dug a little and it seems that `awc` tries to read from the connection before re-using it. If the result is not `Pending` then the connection is dropped.

https://github.com/actix/actix-web/blob/awc-v3.2.0/awc/src/client/pool.rs#L205
https://github.com/actix/actix-web/blob/awc-v3.2.0/awc/src/client/pool.rs#L279

I tries to implement the same logic in `hyper` but that not seems to be a straightforward change.
Is that something that could / should be added to `hyper` ?

**Comment by seanmonstar** [comment]
hyper has read interest registered for the connection while it's sitting idle, so epoll _should_ notify when the read closed event happens.

However, it could be that forcing a read anyways could help. I can't say either way. If it does, great!

I don't have in my mind exactly all the places the code would need to be touched to try that...

**Comment by co42** [comment]
Looks like I also have the same issue with awc, I did not tried long enough the first time.
Thanks for the quick replies !
