### ISSUE TITLE
Server hangs

### ISSUE THREAD

**Issue by 3Hren** [hyperium/hyper#1138]
Hi!

Sometimes, very rarely without load, but very likely under the high-load (~150k RPS), hyper hangs somewhere inside parsing a request not even giving a chance to a request handler (aka `Service`) to process the `Request` even if the entire HTTP frame is received, i.e it receives complete HTTP frame (from curl), parses, but for some condition not decides to forward it to the handler.

**But it wakes up** when RST (or FIN) is received from the other side.

Here is the dump of `tshark` traced locally while curl'ing from the other host:

```bash
 41   3.242621 2a02:6b8:0:1a16::d1:32 -> 2a02:6b8:0:1a16::d1:30 TCP 94 45587 > ndmp [SYN] Seq=0 Win=26670 Len=0 MSS=8890 SACK_PERM=1 TSval=3806148033 TSecr=0 WS=4096
41  42   3.242636 2a02:6b8:0:1a16::d1:30 -> 2a02:6b8:0:1a16::d1:32 TCP 94 ndmp > 45587 [SYN, ACK] Seq=0 Ack=1 Win=26634 Len=0 MSS=8890 SACK_PERM=1 TSval=3821758873 TSecr=3806148033 WS=4096
 43   3.242717 2a02:6b8:0:1a16::d1:32 -> 2a02:6b8:0:1a16::d1:30 TCP 86 45587 > ndmp [ACK] Seq=1 Ack=1 Win=28672 Len=0 TSval=3806148033 TSecr=3821758873
 44   3.242760 2a02:6b8:0:1a16::d1:32 -> 2a02:6b8:0:1a16::d1:30 HTTP 182 GET /metrics HTTP/1.1
 45   3.242769 2a02:6b8:0:1a16::d1:30 -> 2a02:6b8:0:1a16::d1:32 TCP 86 ndmp > 45587 [ACK] Seq=1 Ack=97 Win=28672 Len=0 TSval=3821758873 TSecr=3806148033
45


 46  23.508769 2a02:6b8:0:1a16::d1:32 -> 2a02:6b8:0:1a16::d1:30 TCP 86 45587 > ndmp [FIN, ACK] Seq=97 Ack=1 Win=28672 Len=0 TSval=3806153099 TSecr=3821758873
46  47  23.508871 2a02:6b8:0:1a16::d1:30 -> 2a02:6b8:0:1a16::d1:32 HTTP 353 HTTP/1.1 200 OK  (application/json)
 48  23.508886 2a02:6b8:0:1a16::d1:30 -> 2a02:6b8:0:1a16::d1:32 TCP 86 ndmp > 45587 [FIN, ACK] Seq=268 Ack=98 Win=28672 Len=0 TSval=3821763940 TSecr=3806153099
 49  23.508979 2a02:6b8:0:1a16::d1:32 -> 2a02:6b8:0:1a16::d1:30 TCP 74 45587 > ndmp [RST] Seq=98 Win=0 Len=0
 50  23.508989 2a02:6b8:0:1a16::d1:32 -> 2a02:6b8:0:1a16::d1:30 TCP 74 45587 > ndmp [RST] Seq=98 Win=0 Len=0
```

Here you can see, that we got the entire HTTP frame: `HTTP 182 GET /metrics HTTP/1.1`, acked, but nothing more happens.

After ~20 seconds I've terminated the `curl`, and we see that hyper has woken up and completed processing the request, sending `HTTP 353 HTTP/1.1 200 OK  (application/json)` back, but obviously, no one is waiting for it already.

```bash
esafronov@s30h:~/proxy/cocaine-http-proxy$ uname -a
Linux s32h.xxx.yandex.net 3.18.22-26 #17 SMP Wed Oct 28 14:32:46 MSK 2015 x86_64 x86_64 x86_64 GNU/Linux

esafronov@s30h:~/proxy/cocaine-http-proxy$ rustc --version
rustc 1.18.0-nightly (53f4bc311 2017-04-07)

esafronov@s30h:~/proxy/cocaine-http-proxy$ cat Cargo.lock | grep hyper
 "hyper 0.11.0-a.0 (git+https://github.com/hyperium/hyper)",
name = "hyper"
source = "git+https://github.com/hyperium/hyper#9605e860ff46aa7cf02d4e29624f887604cb6541"
"checksum hyper 0.11.0-a.0 (git+https://github.com/hyperium/hyper)" = "<none>"
```

**Comment by 3Hren** [comment]
Here is more verbose dump to be sure that the entire HTTP frame was received: http://paste.org.ru/?5l7p0z

**Comment by seanmonstar** [comment]
Hm, so are you able to reliably reproduce this? Is there a server I can set up myself to see this?

**Comment by 3Hren** [comment]
> Hm, so are you able to reliably reproduce this? 

I am. I'm very interested in fixing this, you can ping me 24/7 :)

> Is there a server I can set up myself to see this?

Unfortunately it's private right now. I'll try to extract a minimal reproducable example, but it takes time...

Do you have any ideas what it can be?

**Comment by 3Hren** [comment]
Just tested on linux (above) and OS X, hangs on both.

**Comment by seanmonstar** [comment]
I don't know what circumstances would cause it, but I can think of a part of the code that is likely the culprit. There is some code in hyper to track if it has read to the end of a request, but not necessarily until the stream returned `EWOULDBLOCK` (for instance, when there was a `Content-Length` header of 10, it will read exactly 10 bytes). Tokio normally knows to wake the task up again when the socket becomes readable, but it only registers when a read hits `EWOULDBLOCK`. In that case, hyper tries to record what happened, and "wake up" the task once the response has been written back.

**Comment by 3Hren** [comment]
JFYI I've tried minihttp, the problem exists... Seems like the bug is somewhere either in my code or in mio/tokio. Will investigate it more precisely, but I think we can close this issue.
