### ISSUE TITLE
Host header not set when using RequestBuilder header()

### ISSUE THREAD

**Issue by smerrell** [hyperium/hyper#900]
The Host header is no longer being set starting in Hyper 0.9.2. Here is an example that can reproduce the issue: https://github.com/smerrell/hyper-header-issue

The main.rs looks like this:

``` rust
extern crate hyper;

use std::io::Read;

use hyper::Client;
use hyper::header::Host;

fn main() {
    let client = Client::new();
    let mut res = client.get("http://72.8.141.90")
        .header(Host {
            hostname: "rust-lang.org".to_owned(),
            port: None,
        })
        .send()
        .unwrap();

    let mut body = String::new();
    res.read_to_string(&mut body).unwrap();

    println!("response: {}", body);
}
```

It is set by default to 0.9.2, you can use wireshark or some other tool to monitor network traffic. Here are the results I got when running on 0.9.2

```
Frame 40740: 103 bytes on wire (824 bits), 103 bytes captured (824 bits) on interface 0
Ethernet II, Src: Apple_1a:d2:1d (b8:f6:b1:1a:d2:1d), Dst: Apple_e9:a3:8b (24:a2:e1:e9:a3:8b)
Internet Protocol Version 4, Src: 10.0.1.3, Dst: 72.8.141.90
Transmission Control Protocol, Src Port: 54788 (54788), Dst Port: 80 (80), Seq: 1, Ack: 1, Len: 37
Hypertext Transfer Protocol
    GET / HTTP/1.1\r\n
    Host: 72.8.141.90\r\n
    \r\n
    [Full request URI: http://72.8.141.90/]
    [HTTP request 1/1]
    [Response in frame: 40742]
```

When I changed the Cargo.toml from 0.9.2 to 0.9.1 and re-ran the app I got this result on Wireshark:

```
Frame 40169: 112 bytes on wire (896 bits), 112 bytes captured (896 bits) on interface 0
Ethernet II, Src: Apple_1a:d2:1d (b8:f6:b1:1a:d2:1d), Dst: Apple_e9:a3:8b (24:a2:e1:e9:a3:8b)
Internet Protocol Version 4, Src: 10.0.1.3, Dst: 72.8.141.90
Transmission Control Protocol, Src Port: 54784 (54784), Dst Port: 80 (80), Seq: 1, Ack: 1, Len: 46
Hypertext Transfer Protocol
    GET / HTTP/1.1\r\n
    Host: http://rust-lang.org\r\n
    \r\n
    [Full request URI: http://http://rust-lang.org/]
    [HTTP request 1/1]
    [Response in frame: 40170]
```

I've been trying to figure out how to set the header and request without using the RequestBuilder to see if that is the issue or not but I haven't quite been able to figure out how to do that. If I do figure it out, I'll put what I find here. Thanks!

**Comment by seanmonstar** [comment]
Yep, seems this was changed when proxy support was added, which received tweaks to allow the host/port to be found from the original URL, even though the proxy would use a new URL.

A fix would perhaps be to check for the `Host` header before pushing it, or similar, such as using `extend()`.

**Comment by seanmonstar** [comment]
As 0.10.x is no longer actively developed, I'm going to close as wontfix. If anyone wants to send a PR to fix it, I'll merge!
